What is the most famous image of Eton College,"A spokesman representing Eton College released the following statement: ""Eton College takes its legal responsibilities extremely seriously and expects all school activities to comply with the law.",288.txt
What are somefemale schools close to Eton,"In 2008, Eton helped found the Eton, Slough, Windsor and Hounslow Independent and State School Partnership (ISSP), with six local state schools.",288.txt
What evidence was brought forth of a potential hare hunt,"In January 2016, the Eton College beagling club was accused by the League Against Cruel Sports of undertaking an illegal hare hunt.",288.txt
What is the interest of the Savile club at Eton,"However over the years much money was raised for the Eton Mission, a fine church by G. F. Bodley was erected, many Etonians visited, and stimulated among other things the Eton Manor Boys' Club, a notable rowing club which has survived the Mission itself, and the 59 Club for motorcyclists.",288.txt
What diseases can have a major imact on memory,"There are special rules for certain rare diseases (""orphan diseases"") in several major drug regulatory territories.",179.txt
What does SWS stand for,"DCS is reported to stand for ""Digital Collection System""; the system has the same functions as before.",151.txt
What is another name for short-term memory,Hebb distinguished between short-term and long-term memory.,177.txt
What did KF disprove during this study,"In a study by Zlonoga and Gerber (1986), patient 'KF' demonstrated certain deviations from the Atkinson–Shiffrin model.",177.txt
What trouble can interference cause,"This could cause eye trouble, lung ailments, heat exhaustion, cut, and burns.",273.txt
What is an engram trace,The latter component is also called engram or memory traces (Semon 1904).,177.txt
What is a term to describe memory loss,Loss of memory is known as amnesia.,177.txt
What is the Zeigarnik effect,Also relevant is the Zeigarnik effect which states that people remember uncompleted or interrupted tasks better than completed ones.,177.txt
Which hormones are produces when a animal is stressed out,"It is now known to be the hormone that stimulates or regulates fruit ripening and abscission, and it, or the synthetic growth regulator ethephon which is rapidly metabolised to produce ethylene, are used on industrial scale to promote ripening of cotton, pineapples and other climacteric crops.",222.txt
What set of skills is reliant on procedural memory,Procedural memory is primarily employed in learning motor skills and should be considered a subset of implicit memory.,177.txt
What will a person often do with extremely stressful memories,Stressful life experiences may be a cause of memory loss as a person ages.,177.txt
What is something somebody can use to remember something,It can best be summarized as remember how to do something.,177.txt
What neurons are damaged during stressful events,Glucocorticoids that are released during stress damage neurons that are located in the hippocampal region of the brain.,177.txt
What take place during SWS,System consolidation takes place during slow-wave sleep (SWS).,177.txt
What are some catgories of retrospective memory,"Thus, retrospective memory as a category includes semantic, episodic and autobiographical memory.",177.txt
What did conrad find about test subjects,Conrad (1964) found that test subjects had more difficulty recalling collections of letters that were acoustically similar (e.g.,177.txt
What suggests that memory has two different components,"The term of internal representation implies that such definition of memory contains two components: the expression of memory at the behavioral or conscious level, and the underpinning physical neural changes (Dudai 2007).",177.txt
What is the capacity of long term memory,"Another part of long-term memory is episodic memory, ""which attempts to capture information such as 'what', 'when' and 'where'"".",177.txt
What happens to information during the encoding process,In the first stage the information must be changed so that it may be put into the encoding process.,177.txt
What did a similar study done by Garry find,"A separate study by cognitive psychologists Schwabe and Wolf shows that when retention testing is done in a context similar to or congruent with the original learning task (i.e., in the same room), memory impairment and the detrimental effects of stress on learning can be attenuated.",177.txt
What age can an infabt recall steps in an order,"It is only by 9 months of age that infants can recall the actions of a two-step sequence in the correct temporal order - that is, recalling step 1 and then step 2.",177.txt
What did Baddeleys test subjects have touble doing,"While short-term memory encodes information acoustically, long-term memory encodes it semantically: Baddeley (1966) discovered that, after 20 minutes, test subjects had the most difficulty recalling a collection of words that had similar meanings (e.g.",177.txt
What relationship does excitement and memory share,This proves that excitement enhances memory by the stimulation of hormones that affect the amygdala.,177.txt
What was Conrads deal with,Conrad (1964) found that test subjects had more difficulty recalling collections of letters that were acoustically similar (e.g.,177.txt
What is the most widely used way in learing,"Although this only works during daylight hours, it does not use the position of the sun in any way.",109.txt
Can we control what is stored in our sensory memory,The government also was determined to keep full control so that no rebellion of such size would ever happen again.,304.txt
What is the spacing effect,The spacing effect shows that an individual is more likely to remember a list of items when rehearsal is spaced over an extended period of time.,177.txt
In studies what is a relationship between sleeping and learning,Ethnobotany is the study of the relationships between plants and people.,222.txt
What does short-term memory depend on,Hebb distinguished between short-term and long-term memory.,177.txt
What has research shown about our memories,Research has shown that direct injections of cortisol or epinephrine help the storage of recent experiences.,177.txt
What does Conrads finding seem to mean,"With very short presentations, participants often report that they seem to ""see"" more than they can actually report.",177.txt
What did a study performed by Schwabe and wolf show,"A separate study by cognitive psychologists Schwabe and Wolf shows that when retention testing is done in a context similar to or congruent with the original learning task (i.e., in the same room), memory impairment and the detrimental effects of stress on learning can be attenuated.",177.txt
What can the scent of vanilla be used for,"The room in which the experiment took place was infused with the scent of vanilla, as odour is a strong cue for memory.",177.txt
What does memorization mean,"Some plants reproduce sexually, some asexually, and some via both means.",222.txt
What is Korsakoff's syndrome,"Korsakoff's syndrome, also known as Korsakoff's psychosis, amnesic-confabulatory syndrome, is an organic brain disease that adversely affects memory by widespread loss or shrinkage of neurons within the prefrontal cortex.",177.txt
What is the second memory stage,Storage is the second memory stage or process.,177.txt
What learning tool did Cosmos rosselliius write about,"Then you write down the answer.""",360.txt
What exactly does short-term memory allow a person to do,Hebb distinguished between short-term and long-term memory.,177.txt
What has most of the research on memories revolved around,"In fact, research has revealed that our memories are constructed.",177.txt
What did KF have trouble doing,"Patient KF was brain damaged, displaying difficulties regarding short-term memory.",177.txt
What can cause a person to have fake memories,Stressful life experiences may be a cause of memory loss as a person ages.,177.txt
What is episodic memory,"Another part of long-term memory is episodic memory, ""which attempts to capture information such as 'what', 'when' and 'where'"".",177.txt
What can impact memory performance in a positive way,"The more long term the exposure to stress is, the more impact it may have.",177.txt
What is retroactive interference,"There is retroactive interference, when learning new information makes it harder to recall old information and proactive interference, where prior learning disrupts recall of new information.",177.txt
What do most elderly people worry about,"In the same publication, Feynman also talks about his worries in the atomic bomb age, feeling for some considerable time that there was a high risk that the bomb would be used again soon, so that it was pointless to build for the future.",360.txt
What did Spellings' findings reveal,Candidates to profession were tested to reveal whether they were actually married women who had merely separated from their husbands.,287.txt
What hinders schooling for child labourers,From the 1870s Child labour was restricted by compulsorry schooling.,273.txt
What types of child labour does this prohibit,Legislation across the world prohibit child labour.,273.txt
What type of agreement was the 2001 Harkin-Engel Protocol,"In 2001, a voluntary agreement called the Harkin-Engel Protocol, was accepted by the international cocoa and chocolate industry to eliminate the worst forms of child labour, as defined by ILO's Convention 182, in West Africa.",273.txt
When was Brazil colonized,"Child labour has been a consistent struggle for children in Brazil ever since the country was colonized on April 22, 1550 by Pedro Álvares Cabral.",273.txt
What was the verdict,"Another part of long-term memory is episodic memory, ""which attempts to capture information such as 'what', 'when' and 'where'"".",177.txt
What former Soviet Union continued child labour programs,"Out of former Soviet Union republics Uzbekistan continued and expanded the program of child labour on industrial scale to increase profits on the main source of Islam Karimov's income, cotton harvesting.",273.txt
What is a natural process of child development,Work is undertaken from an early age by vast numbers of children in the world and may have a natural place in growing up.,273.txt
What did the United States pass in 2004,"In 2004, the United States passed an amendment to the Fair Labour Standards Act of 1938.",273.txt
Who claimed these reports as being inaccurate,"However, the exiled leaders and organisations claims that ethnic population is 40%, which is implicitly contrasted with CIA report (official US report).",226.txt
What community has the most prevalency for child labour,"Glencore denied it used child labour, and said it has strict policy of not using child labour.",273.txt
Who taught the skills needed for the children to work,Some view that work is good for the character-building and skill development of children.,273.txt
What are the risks of child labour in drug cartels,"Many children are used by drug cartels to sell and carry drugs, guns, and other illegal substances because of their perception of innocence.",273.txt
When did the CEO go on trial,Agriprocessors' CEO went to trial on these charges in state court on 4 May 2010.,273.txt
What is another source of mining dangerous to children workers,Small-scale artisanal mining of gold is another source of dangerous child labour in poor rural areas in certain parts of the world.,273.txt
What does Primark produce,"Primark continued to investigate the allegations for three years, concluding that BBC report was a fake.",273.txt
What restricted the 1870s Child labour in Australia,From the 1870s Child labour was restricted by compulsorry schooling.,273.txt
What do African children do primarily while working at home,"In 2010, sub-saharan Africa had the highest incidence rates of child labour, with several African nations witnessing over 50 percent of children aged 5–14 working.",273.txt
What percent of materials go to China,Over 60 of Katanga's 75 processing plants are owned by Chinese companies and 90 percent of the region's minerals go to China.,273.txt
What time were home manufactoring activities for children taking place,The Shunga Empire played an imperative role in patronizing Indian culture at a time when some of the most important developments in Hindu thought were taking place.,304.txt
What are children able to do during intense work situations,"Two out of three child workers work alongside their parents, in unpaid family work situations.",273.txt
What happened in the European Union in 1996,"Similarly, in 1996, member countries of the European Union, per Directive 94/33/EC, agreed to a number of exceptions for young people in its child labour laws.",273.txt
Who else did they accuse of using child labor products,"In 2008, the BBC reported that the company Primark was using child labor in the manufacture of clothing.",273.txt
What do child labourers work on in West Africa,"In west Africa, in countries such as Mali - the third largest exporter of gold in Africa - between 20,000 and 40,000 children work in artisanal mining.",273.txt
What culture in the US benefits from this Act,Marketing of prescription drugs in the US is regulated by the federal Prescription Drug Marketing Act of 1987.,179.txt
What did Glencore admit to with regards to child labor,"According to The Economist, Oxford and Cambridge admit more Etonians each year than applicants from the whole country who qualify for free school meals.",288.txt
When did the English East India Company defeat Siraj-ud-Daula,"On 23 June 1757, the English East India Company defeated Siraj-ud-Daula, the Nawab of Bengal, in the Battle of Plassey.",273.txt
Who colonized Brazil,"Child labour has been a consistent struggle for children in Brazil ever since the country was colonized on April 22, 1550 by Pedro Álvares Cabral.",273.txt
What is the largest employer of child labour,Worldwide agriculture is the largest employer of child labour.,273.txt
What is the min working age in Brazil,"In Brazil, the minimum working age has been identified as fourteen due to continuous constitutional amendments that occurred in 1934, 1937, and 1946.",273.txt
What did the international acts do,These international acts encouraged major changes to the workforce in India which occurred in 1986 when the Child Labour (Prohibition and Regulation) Act was put into place.,273.txt
What is an issue in Africa with child labour definitions,"Although many actions have been taken to end this epidemic, child labour in Africa is still an issue today due to the unclear definition of adolescence and how much time is needed for children to engage in activities that are crucial for their development.",273.txt
What became an issue for the working child,"With such a high percentage of children working, the rising of illiteracy, and the lack of a formal education became a widespread issue for many children who worked to provide for their families.",273.txt
Some child work as guides for whom,"Some children work as guides for tourists, sometimes combined with bringing in business for shops and restaurants.",273.txt
What is the aim of this,This initiative aims to progressively eliminate child labour through strengthening national capacities to address some of the causes of child labour.,273.txt
What did this act due,The RICO Act is still used today for all organized crime and any individuals who might fall under the Act.,151.txt
What is Kaminfegerkinder,"As in many other countries, child labour in Switzerland affected among the so-called Kaminfegerkinder (""chimney sweep children"") and chidren working p.e.",273.txt
When was child labour first documented in Brazil,"Child labour has been a consistent struggle for children in Brazil ever since the country was colonized on April 22, 1550 by Pedro Álvares Cabral.",273.txt
Was there a period when child labour was essential,"Yet due to there being no clear definition of how to classify what a child or youth is, there has been little historical documentation of child labour during the colonial period.",273.txt
What did it help do to,Mabel and Bell mobilized the community to help victims in Halifax.,56.txt
Who were the victims of industrial accidents,Boys and girls were victims of industrial accidents on a daily basis.,273.txt
What century did apprenticeships begin to take place,Most migrations begin with the birds starting off in a broad front.,109.txt
What migrants worked on the Ivory Coast,"[not in citation given][better source needed] Malian migrants have long worked on cocoa farms in the Ivory Coast, but in 2000 cocoa prices had dropped to a 10-year low and some farmers stopped paying their employees.",273.txt
What does child labour do for adults,"Child labour, claim these activists, also leads to poor labour standards for adults, depresses the wages of adults in developing countries as well as the developed countries, and dooms the third world economies to low-skill jobs only capable of producing poor quality cheap exports.",273.txt
What does child labour deprive children of,"Glencore denied it used child labour, and said it has strict policy of not using child labour.",273.txt
What are the figures for cocoa farmers using child labour,"In a BBC interview, the ambassador for Ivory Coast to the United Kingdom called these reports of widespread use of slave child labour by 700,000 cocoa farmers as absurd and inaccurate.",273.txt
What is the third largest exporter of gold in Africa,"In west Africa, in countries such as Mali - the third largest exporter of gold in Africa - between 20,000 and 40,000 children work in artisanal mining.",273.txt
What age were children allowed to do light labour,Both the Worst Forms Convention (C182) and the Minimum Age Convention (C138) are examples of international labour standards implemented through the ILO that deal with child labour.,273.txt
What happened at Verdingkinder auctions,"There were even Verdingkinder auctions where children were handed over to the farmer asking the least amount of money from the authorities, thus securing cheap labour for his farm and relieving the authority from the financial burden of looking after the children.",273.txt
What is the cobalt used for,"In 2008, Bloomberg claimed child labour in copper and cobalt mines that supplied Chinese companies in Congo.",273.txt
What else did the BBC expose,"Notable Old Etonians in the media include the former Political Editor of both ITN and The Times, Julian Haviland; the current BBC Deputy Political Editor, James Landale, and the BBC Science Editor, David Shukman; the current President of Conde Nast International and Managing Director of Conde Nast UK, Nicholas Coleridge; the former ITN newscaster and BBC Panorama presenter, Ludovic Kennedy; current BBC World News and BBC Rough Justice current affairs presenter David Jessel; former chief ITV and Channel 4 racing commentator John Oaksey; 1950s BBC newsreader and 1960s ITN newscaster Timothy Brinton; 1960s BBC newsreader Corbet Woodall; the former Editor of The Daily Telegraph, Charles Moore; the former Editor of The Spectator, Ferdinand Mount; and the current Editor of The Mail on Sunday, Geordie Greig.",288.txt
All but what type of children must learn to clean,Other types of evidence must be used for that purpose.,281.txt
What schools required child labour,Poverty and lack of schools are considered as the primary cause of child labour.,273.txt
Who did the children work beside,"These laws do not consider all work by children as child labour; exceptions include work by child artists, family duties, supervised training, certain categories of work such as those by Amish children, some forms of child work common among indigenous American children, and others.",273.txt
What did children roll in a factory,During the Industrial Revolution many of these children moved from farm work to factory work.,273.txt
What are some of the target countries,"Among its targets was the Southern Christian Leadership Conference, a leading civil rights organization with clergy leadership.",151.txt
What encourages child labour across the globe,Legislation across the world prohibit child labour.,273.txt
Who dismissed the allegations,"In response to the tribunal's ruling concerning the allegations about Prince Harry, the School issued a statement, saying Forsyth's claims ""were dismissed for what they always have been - unfounded and irrelevant.""",288.txt
What types of child labour did Switzerland employ,"Other types of domestic child labour include working in commercial plantations, begging, and other sales such as boot shining.",273.txt
What country does he argue needs child labor to survive,"In pre-industrial societies, there was little need for children to attend school.",273.txt
Who was the master of the east of India,"The British thus became masters of east India (Bengal, Bihar, Orissa) – a prosperous region with a flourishing agriculture, industry and trade.",273.txt
"What happened to the 50,000 children in the UNICEF study","For example, a UNICEF study found that after the Child Labour Deterrence Act was introduced in the US, an estimated 50,000 children were dismissed from their garment industry jobs in Bangladesh, leaving many to resort to jobs such as ""stone-crushing, street hustling, and prostitution"", jobs that are ""more hazardous and exploitative than garment production"".",273.txt
What was the age range of colonial child workers,"Although there are many counts of children under the age of ten working for factories, the majority of children workers were between the ages of ten and fourteen.",273.txt
What is benefical work for children,"These laws do not consider all work by children as child labour; exceptions include work by child artists, family duties, supervised training, certain categories of work such as those by Amish children, some forms of child work common among indigenous American children, and others.",273.txt
What happened to the reward the BBC received,The BBC News media outlet obtained video footage of a man with severe burns who received no assistance from passers-by or police officers even though he was lying on the ground in a public area.,226.txt
What did child do in textile mills in the US,"This included children who rolled cigarettes, engaged in factory work, worked as bobbin doffers in textile mills, worked in coal mines and were employed in canneries.",273.txt
What do drug cartels do with child workers,"Many children are used by drug cartels to sell and carry drugs, guns, and other illegal substances because of their perception of innocence.",273.txt
What was the main source of income for Islam Karimov,"Out of former Soviet Union republics Uzbekistan continued and expanded the program of child labour on industrial scale to increase profits on the main source of Islam Karimov's income, cotton harvesting.",273.txt
What industry was accused of profiting from child labour,The cocoa industry was accused of profiting from child slavery and trafficking.,273.txt
What caused child labour to decrease in the 20th century,Factories and mines were not the only places where child labour was prevalent in the early 20th century.,273.txt
Who reported Ivory Coast farmers usage of child labour,"In 1998, UNICEF reported that Ivory Coast farmers used enslaved children – many from surrounding countries.",273.txt
What did parents do when the wages were finally raised,Children aged 5–14 worked alongside the parents.,273.txt
What happens to the wages of adults,"Child labour, claim these activists, also leads to poor labour standards for adults, depresses the wages of adults in developing countries as well as the developed countries, and dooms the third world economies to low-skill jobs only capable of producing poor quality cheap exports.",273.txt
What other international laws deal with child labour,Both the Worst Forms Convention (C182) and the Minimum Age Convention (C138) are examples of international labour standards implemented through the ILO that deal with child labour.,273.txt
What did the BBC program make their viewers question,"Thus, the wording of the questions distorted viewers’ memories of the event.",177.txt
What do international actions do according to these scholars,Other scholars[who?],273.txt
When did industrailization take off in Australia,"The foreign citizen population was 21.8% in 2004, about the same as in Australia.",247.txt
What are child creuseurs,"The children are creuseurs, that is they dig the ore by hand, carry sacks of ores on their backs, and these are then purchased by these companies.",273.txt
Who are children predominantly employed by,"Vast majority of child labour is found in rural settings and informal urban economy; children are predominantly employed by their parents, rather than factories.",273.txt
According to article Tibet has remained under what jurisdiction,"China Daily, a CCP-controlled news organization since 1981, states in a 2008 article that although there were dynastic changes after Tibet was incorporated into the territory of Yuan dynasty's China in the 13th century, ""Tibet has remained under the jurisdiction of the central government of China.""",6.txt
Who invited Je Tsongkhapa to come pay tribute,"When the Ming Yongle Emperor invited Je Tsongkhapa (1357–1419), founder of the Gelug school, to come to the Ming court and pay tribute, the latter declined.",6.txt
What title was the fourth Dalai Lama granted ,"To further cement the Mongol-Tibetan alliance, the great-grandson of Altan Khan—the 4th Dalai Lama (1589–1616)—was made the fourth Dalai Lama.",6.txt
