What plant did Mendel use to demonstrate inheritance,What Mendel learned from studying plants has had far reaching benefits outside of botany.,222.txt
What makes up the bodies of vascular plants,"Non-vascular plants, the liverworts, hornworts and mosses do not produce ground-penetrating vascular roots and most of the plant participates in photosynthesis.",222.txt
What can auxin plant hormones also be used as,The discovery and identification of the auxin plant hormones by Kenneth V. Thimann in 1948 enabled regulation of plant growth by externally applied chemicals.,222.txt
What gas is in lower concentration now due to plants,The concentration of carbon dioxide in the atmosphere today is much lower than it was when plants emerged onto land during the Ordovician and Silurian periods.,222.txt
On what do plants depend in their environment,Plants depend on certain edaphic (soil) and climatic factors in their environment but can modify these factors too.,222.txt
What organelles are unique to algae,"Plants and various other groups of photosynthetic eukaryotes collectively known as ""algae"" have unique organelles known as chloroplasts.",222.txt
What is the meaning of dichotomous keys,"During the 18th century, systems of plant identification were developed comparable to dichotomous keys, where unidentified plants are placed into taxonomic groups (e.g.",222.txt
In what year was this genome sequenced,"Arabidopsis was the first plant to have its genome sequenced, in 2000.",222.txt
In what year to Candolle introduce the Candollean system,"The Candollean system reflected his ideas of the progression of morphological complexity and the later classification by Bentham and Hooker, which was influential until the mid-19th century, was influenced by Candolle's approach.",222.txt
What mechanism can be studied through chromosome sequencing,"Most sexually reproducing organisms are diploid, with paired chromosomes, but doubling of their chromosome number may occur due to errors in cytokinesis.",222.txt
What theory did Schleiden co-found,Schleiden was a microscopist and an early plant anatomist who co-founded the cell theory with Theodor Schwann and Rudolf Virchow and was among the first to grasp the significance of the cell nucleus that had been described by Robert Brown in 1831.,222.txt
Who coined the term cells,"In 1665, using an early microscope, Polymath Robert Hooke discovered cells, a term he coined, in cork, and a short time later in living plant tissue.",222.txt
What herbalist wrote about medicinal plants in the 16th century,Naturalist Conrad von Gesner (1516–1565) and herbalist John Gerard (1545–c.,222.txt
What was the De Materia Medica written about,"De Materia Medica was widely read for more than 1,500 years.",222.txt
What acid slows or stops cell division,"The first known auxin, indole-3-acetic acid (IAA), which promotes cell growth, was only isolated from plants about 50 years later.",222.txt
What can cause the doubling of chromosome pairs,"Most sexually reproducing organisms are diploid, with paired chromosomes, but doubling of their chromosome number may occur due to errors in cytokinesis.",222.txt
What is the goal of plant ecology,"The goals of plant ecology are to understand the causes of their distribution patterns, productivity, environmental impact, evolution, and responses to environmental change.",222.txt
What science led to botany,"Botany, also called plant science(s) or plant biology, is the science of plant life and a branch of biology.",222.txt
What does the plant use for internal processes,Plant physiology encompasses all the internal chemical and physical activities of plants associated with life.,222.txt
What does the phylogeny of a group represent,The evolutionary relationships and heredity of a group of organisms is called its phylogeny.,222.txt
For what are leaves used,Other approaches used in pigeon homing studies make use of the direction in which the bird vanishes on the horizon.,109.txt
What traits show a shared ancestry,"The opposite of a Show Up is a ""Rip"".",288.txt
What is transpiration,Minerals and water are transported from roots to other parts of the plant in the transpiration stream.,222.txt
What is used now to group plants,In 1998 the Angiosperm Phylogeny Group published a phylogeny for flowering plants based on an analysis of DNA sequences from most families of flowering plants.,222.txt
What was the first plant to have its genome sequenced,"Arabidopsis was the first plant to have its genome sequenced, in 2000.",222.txt
When is the raw form of glucose formed,The sales of the record beat the largest sales in one week on vinyl since 1991.,282.txt
In what plant were cells first discovered by microscope,"In 1665, using an early microscope, Polymath Robert Hooke discovered cells, a term he coined, in cork, and a short time later in living plant tissue.",222.txt
What is the most narrow grouping of a plant,"Often, this front narrows into one or more preferred routes termed flyways.",109.txt
What do Fick's laws do,"In 1855, Adolf Fick formulated Fick's laws that enabled the calculation of the rates of molecular diffusion in biological systems.",222.txt
What science was botany considered to be a part of,"Botany, also called plant science(s) or plant biology, is the science of plant life and a branch of biology.",222.txt
What is the scientific name for seed plants,"The scientific name of a plant represents its genus and its species within the genus, resulting in a single world-wide name for each organism.",222.txt
What cells produce antibodies,These antibodies can also produce a negative response.,111.txt
Who originally discovered these parts of the immune system,"It also involves diseases of other systems, where immune reactions play a part in the pathology and clinical features.",111.txt
What is the primary trigger for immunological changes in teens,Valleys running south to north trigger the best effect.,247.txt
What characterizes a hypersensitivity,Other immune system disorders include various hypersensitivities (such as in asthma and other allergies) that respond inappropriately to otherwise harmless compounds.,111.txt
What two conditions apply to good immunological study,"[citation needed] Some researchers, especially in early British cultural studies, apply a Marxist model to the field.",297.txt
What program requires an additional two years of study,A Master’s degree requires two years of study following the attainment of a bachelor's degree.,111.txt
"In babies, what is another element impacting immune response","On the basis of CST, Burnet developed a theory of how an immune response is triggered according to the self/nonself distinction: ""self"" constituents (constituents of the body) do not trigger destructive immune responses, while ""nonself"" entities (e.g., pathogens, an allograft) trigger a destructive immune response.",111.txt
Evidence suggests that receptors on B cells may do what,There is also some evidence that cell surface receptors on B cells and macrophages may detect sex hormones in the system.,111.txt
What virus specifically suppresses those cells,"The most well-known disease that affects the immune system itself is AIDS, an immunodeficiency characterized by the suppression of CD4+ (""helper"") T cells, dendritic cells and macrophages by the Human Immunodeficiency Virus (HIV).",111.txt
What are two opposing theories of early 20th century immunology,"At the beginning of the 20th century, the early discs played for two minutes, the same as early cylinder records.",282.txt
Humoral immunology involves the interaction of what two elements,The humoral (antibody) response is defined as the interaction between antibodies and antigens.,111.txt
What is the most famous immune system disease,"It charts, measures, and contextualizes the: physiological functioning of the immune system in states of both health and diseases; malfunctions of the immune system in immunological disorders (such as autoimmune diseases, hypersensitivities, immune deficiency, and transplant rejection); the physical, chemical and physiological characteristics of the components of the immune system in vitro, in situ, and in vivo.",111.txt
What kind of disease is AIDS,"The most well-known disease that affects the immune system itself is AIDS, an immunodeficiency characterized by the suppression of CD4+ (""helper"") T cells, dendritic cells and macrophages by the Human Immunodeficiency Virus (HIV).",111.txt
Immunology is a branch of what larger field of study,Immunology is a branch of biomedical science that covers the study of immune systems in all organisms.,111.txt
What are the major organs of the immune system,"The immune system has been divided into a more primitive innate immune system and, in vertebrates, an acquired or adaptive immune system.",111.txt
The Langone Medical Center is part of what college,"For example, in New York State, there are several universities that offer the AAI courses immunology: Albany Medical College, Cornell University, Icahn School of Medicine at Mount Sinai, New York University Langone Medical Center, University at Albany (SUNY), University at Buffalo (SUNY), University of Rochester Medical Center and Upstate Medical University (SUNY).",111.txt
Adolescent immunological changes can also result in what,The many cultivated varieties of wheat are the result of multiple inter- and intra-specific crosses between wild species and their hybrids.,222.txt
What specific hormone catalyzes these changes in females,"During adolescence, the human body undergoes various physical, physiological and immunological changes triggered and mediated by hormones, of which the most significant in females is 17-β-oestradiol (an oestrogen) and, in males, is testosterone.",111.txt
What are antibodies comprised of,"Antibodies are specific proteins released from a certain class of immune cells known as B lymphocytes, while antigens are defined as anything that elicits the generation of antibodies (""anti""body ""gen""erators).",111.txt
Newborns can acquire antibodies from the mother through what means,"For example, the mean level of C3 in a newborn is approximately 65% of that found in the adult.",111.txt
What is a type of immune system disorder,"The immune system has been divided into a more primitive innate immune system and, in vertebrates, an acquired or adaptive immune system.",111.txt
What is one type of adaptive immune system component,"The immune system has been divided into a more primitive innate immune system and, in vertebrates, an acquired or adaptive immune system.",111.txt
The goal of an immunologist is to study what beings,The most important thing about being immunologists is the research because it is the biggest portion of their jobs.,111.txt
What property of T cells caused modification of CST,"During this period of upheaval in the provinces he declared that all the estates of the Church, its congregations, and its religious orders were national property—though in Valencia, most of this property was subsequently acquired by the local bourgeoisie.",160.txt
What are some examples of hypersensitivities,Other immune system disorders include various hypersensitivities (such as in asthma and other allergies) that respond inappropriately to otherwise harmless compounds.,111.txt
What triggers an immune response according to CST,"On the basis of CST, Burnet developed a theory of how an immune response is triggered according to the self/nonself distinction: ""self"" constituents (constituents of the body) do not trigger destructive immune responses, while ""nonself"" entities (e.g., pathogens, an allograft) trigger a destructive immune response.",111.txt
When was clonal selection theory first proposed,"In 1960, Ali Javan co-invented the first gas laser, and fuzzy set theory was introduced by Lotfi Zadeh.",400.txt
What disciplines in medicine have particularly strong immunology applications,"Immunology has applications in numerous disciplines of medicine, particularly in the fields of organ transplantation, oncology, virology, bacteriology, parasitology, psychiatry, and dermatology.",111.txt
What new areas are immunologists studying with more frequency,The most important thing about being immunologists is the research because it is the biggest portion of their jobs.,111.txt
"In general, what does immunology study",Immunology is a branch of biomedical science that covers the study of immune systems in all organisms.,111.txt
What does the introductory AAI immunology course do,The AAI immunology courses include an Introductory Course and an Advance Course.,111.txt
What activity is also greatly reduced in newborn infants,Phagocytic activity is also greatly impaired in newborns.,111.txt
When was migration finally accepted,"On 8 September 1945, U.S. Lt. Gen. John R. Hodge arrived in Incheon to accept the Japanese surrender south of the 38th parallel.",199.txt
When was migration first recorded,"Dharmapala founded the Vikramashila and revived Nalanda, considered one of the first great universities in recorded history.",304.txt
Who recorded the earliest records of migration,"In January 1938, Milt Gabler started recording for his new label, Commodore Records, and to allow for longer continuous performances, he recorded some 12-inch records.",282.txt
What is an example of a shorter migration,"Shorter migrations are common, including altitudinal migrations on mountains such as the Andes and Himalayas.",109.txt
What are the waxwings Bombycilla moving in response to,"Species that have no long-distance migratory relatives, such as the waxwings Bombycilla, are effectively moving in response to winter weather and the loss of their usual winter food, rather than enhanced breeding opportunities.",109.txt
What species has no long-distance migratory relatives,"Species that have no long-distance migratory relatives, such as the waxwings Bombycilla, are effectively moving in response to winter weather and the loss of their usual winter food, rather than enhanced breeding opportunities.",109.txt
What is a greater threat of disease transmission,"Due to the global spread of avian influenza, bird migration has been studied as a possible mechanism of disease transmission, but it has been found not to present a special risk; import of pet and domestic birds is a greater threat.",109.txt
What is a cause of death to birds during migration,Bird migration is not limited to birds that can fly.,109.txt
What route does a migrating bird usually follow,"Often, the migration route of a long-distance migrator bird doesn't follow a straight line between breeding and wintering grounds.",109.txt
What is leap frog migration,This is an example of leap-frog migration.,109.txt
What do young birds form attachments to,Long distance migrants are believed to disperse as young birds and form attachments to potential breeding sites and to favourite wintering sites.,109.txt
What happens in polygynous species with sexual dimophism,"In polygynous species with considerable sexual dimorphism, males tend to return earlier to the breeding sites than their females.",109.txt
What kind of bird flies less efficiently,Theoretical analyses show that detours that increase flight distance by up to 20% will often be adaptive on aerodynamic grounds - a bird that loads itself with food to cross a long barrier flies less efficiently.,109.txt
What does reverse migration lead to,"Reverse migration, where the genetic programming of young birds fails to work properly, can lead to rarities turning up as vagrants thousands of kilometres out of range.",109.txt
What controls a birds migration,Bird migration is not limited to birds that can fly.,109.txt
What do some birds of prey specialize on,Some birds of prey specialize on migrating waders.,109.txt
Who was scientific ringing pioneered by,Scientific ringing was pioneered by Hans Christian Cornelius Mortensen in 1899.,109.txt
What else is climate change been shown to change,"Studies have shown a variety of effects including timing changes in migration, breeding as well as population variations.",109.txt
What does flying in flocks reduce,"Apart from physiological adaptations, migration sometimes requires behavioural changes such as flying in flocks to reduce the energy used in migration or the risk of predation.",109.txt
What causes the behavioral adaptations necessary for migration,"While it is agreed that the behavioral and physiological adaptations necessary for migration are under genetic control, some authors have argued that no genetic change is necessary for migratory behavior to develop in a sedentary species because the genetic framework for migratory behavior exists in nearly all avian lineages.",109.txt
What year was Thomas Bewick's book published,"Thomas Bewick's A History of British Birds (Volume 1, 1797) mentions a report from ""a very intelligent master of a vessel"" who, ""between the islands of Minorca and Majorca, saw great numbers of Swallows flying northward"", and states the situation in Britain as follows: Bewick then describes an experiment which succeeded in keeping swallows alive in Britain for several years, where they remained warm and dry through the winters.",109.txt
Since when have swans been marked,Swans have been marked with a nick on the beak since about 1560 in England.,109.txt
When do large birds of pray migrate,These birds migrate in the daytime.,109.txt
What percentage increase in flight distance will often be adaptive,Theoretical analyses show that detours that increase flight distance by up to 20% will often be adaptive on aerodynamic grounds - a bird that loads itself with food to cross a long barrier flies less efficiently.,109.txt
What is the most common directionof migration in autumn,"More common species, such as the European honey buzzard Pernis apivorus, can be counted in hundreds of thousands in autumn.",109.txt
What do water birds avoid while migrating,"These routes typically follow mountain ranges or coastlines, sometimes rivers, and may take advantage of updrafts and other wind patterns or avoid geographical barriers such as large stretches of open water.",109.txt
What is studied quantitatively inside the cage,The orientation behaviour of the bird inside the cage is studied quantitatively using the distribution of marks that the bird leaves on the walls of the cage.,109.txt
What other species does migration help,"The ability of birds to navigate during migrations cannot be fully explained by endogenous programming, even with the help of responses to environmental cues.",109.txt
What to the migrating birds usually follow,"Often, the migration route of a long-distance migrator bird doesn't follow a straight line between breeding and wintering grounds.",109.txt
When were birds last seen in Keoladeo National Park,Birds were last seen in their favourite wintering grounds in Keoladeo National Park in 2002.,109.txt
What virus is maintained in birds without lethal effects,"Some viruses that are maintained in birds without lethal effects, such as the West Nile Virus may however be spread by migrating birds.",109.txt
What is flying past their destinations called,"This can be due to flying past their destinations as in the ""spring overshoot"" in which birds returning to their breeding areas overshoot and end up further north than intended.",109.txt
What does successful migration depend on for some waders,Plants depend on certain edaphic (soil) and climatic factors in their environment but can modify these factors too.,222.txt
What bird is mentioned in the book of Job,"The Bible also notes migrations, as in the Book of Job (39:26), where the inquiry is made: ""Is it by your insight that the hawk hovers, spreads its wings southward?""",109.txt
What causes the timing of migration,The timing of migration seems to be controlled primarily by changes in day length.,109.txt
Who noted that cranes traveled from Scythia to the Nile,Aristotle noted that cranes traveled from the steppes of Scythia to marshes at the headwaters of the Nile.,109.txt
Until what year did the belief of hibernating birds persist,The driest conditions persist in all inner alpine valleys that receive less rain because arriving clouds lose a lot of their content while crossing the mountains before reaching these areas.,247.txt
What are examples of day migrating raptors,Satellite tracking of day migrating raptors such as ospreys and honey buzzards has shown that older individuals are better at making corrections for wind drift.,109.txt
When do the birds return to warmer regions,"A related phenomenon called ""abmigration"" involves birds from one region joining similar birds from a different breeding region in the common winter grounds and then migrating back along with the new population.",109.txt
What do greater noctule bats feed on,Greater noctule bats feed on nocturnal migrating passerines.,109.txt
What threatens some bird species,Hunting along migration routes threatens some bird species.,109.txt
What are many long distance migrants genetically programmed to do,Many long-distance migrants appear to be genetically programmed to respond to changing day length.,109.txt
When do many insectivorous birds migrate,"Many of the smaller insectivorous birds including the warblers, hummingbirds and flycatchers migrate large distances, usually at night.",109.txt
What else is navigation based on,Navigation is based on a variety of senses.,109.txt
What years did Red crossbills invade England,"Red crossbills Loxia curvirostra too are irruptive, with widespread invasions across England noted in 1251, 1593, 1757, and 1791.",109.txt
What do many birds use as a compass,Many birds have been shown to use a sun compass.,109.txt
What is a benefit of nocturnal migration,One cost of nocturnal migration is the loss of sleep.,109.txt
What are other migration hazards,"Other migration hazards include pollution, storms, wildfires, and habitat destruction along migration routes, denying migrants food at stopover points.",109.txt
What has been studied as a mechanism of disease transmission,"Due to the global spread of avian influenza, bird migration has been studied as a possible mechanism of disease transmission, but it has been found not to present a special risk; import of pet and domestic birds is a greater threat.",109.txt
What is highly labile,Migration in birds is highly labile and is believed to have developed independently in many avian lineages.,109.txt
Who describes an experiment with swallows,"Thomas Bewick's A History of British Birds (Volume 1, 1797) mentions a report from ""a very intelligent master of a vessel"" who, ""between the islands of Minorca and Majorca, saw great numbers of Swallows flying northward"", and states the situation in Britain as follows: Bewick then describes an experiment which succeeded in keeping swallows alive in Britain for several years, where they remained warm and dry through the winters.",109.txt
Who takes advantage of migrating birds,Some predators take advantage of the concentration of birds during migration.,109.txt
What kind of birds fly low over water,"Seabirds fly low over water but gain altitude when crossing land, and the reverse pattern is seen in landbirds.",109.txt
Who do abmigrating birds return with,"As the days shorten in autumn, the birds return to warmer regions where the available food supply varies little with the season.",109.txt
What preys on nocturnal passerine migrants,"A similar strategy is adopted by the greater noctule bat, which preys on nocturnal passerine migrants.",109.txt
What altitude range is most migration recorded,Birds fly at varying altitudes during migration.,109.txt
What might help migrating birds navigate,"The ability of birds to navigate during migrations cannot be fully explained by endogenous programming, even with the help of responses to environmental cues.",109.txt
What is the primary motivation for migration,"The primary motivation for migration appears to be food; for example, some hummingbirds choose not to migrate if fed through the winter.",109.txt
What kind of bird is most likely to abmigrate,"Another set of restrictions was passed in 1998 that restricted the kinds of work youth could partake in, such as work that was considered hazardous like running construction equipment, or certain kinds of factory work.",273.txt
What is magnetoception,"Navigation has also been shown to be based on a combination of other abilities including the ability to detect magnetic fields (magnetoception), use visual landmarks as well as olfactory cues.",109.txt
What is another benefit of nocturnal migration,One cost of nocturnal migration is the loss of sleep.,109.txt
What is Cluster N,"There is a neural connection between the eye and ""Cluster N"", the part of the forebrain that is active during migrational orientation, suggesting that birds may actually be able to see the magnetic field of the earth.",109.txt
When do long distance migrants disperse,"Approximately 1800 of the world's 10,000 bird species are long-distance migrants.",109.txt
"Who wrote ""The Natural History of Selborne""","Even the ""highly observant"" Gilbert White, in his posthumously published 1789 The Natural History of Selborne, quoted a man's story about swallows being found in a chalk cliff collapse ""while he was a schoolboy at Brighthelmstone"", though the man denied being an eyewitness.",109.txt
What are waders called in North America,A similar situation occurs with waders (called shorebirds in North America).,109.txt
What obsticals will migrating birds avoid,Some birds of prey specialize on migrating waders.,109.txt
