What were the Reduit,"The Swiss military strategy was changed from one of static defence at the borders to protect the economic heartland, to one of organised long-term attrition and withdrawal to strong, well-stockpiled positions high in the Alps known as the Reduit.",247.txt
Who has compulsory military service in Switzerland,Compulsory military service concerns all male Swiss citizens; women can serve voluntarily.,247.txt
When was a second series of 9 bilateral agreements signed,"A second series covering nine areas was signed in 2004 and has since been ratified, which includes the Schengen Treaty and the Dublin Convention besides others.",247.txt
What is the population of the largest canton,"In the largest Canton of Graubünden, lying entirely in the Alps, population density falls to 27 /km² (70 /sq mi).",247.txt
What type of government does Switzerland have,Features of all three of the other types of diarrhea[clarification needed] can be found in this type of diarrhea.,347.txt
What was the name d'Schwiiz used for,"The Swiss German name of the country, Schwiiz, is homophonous to that of the canton and the settlement, but distinguished by the use of the definite article (d'Schwiiz for the Confederation, but simply Schwyz for the canton and the town).",247.txt
When were the first ski championships held in Murren,The first world ski championships were held in Mürren (1931) and St. Moritz (1934).,247.txt
What was the Swiss German name for Schwyz,"The Swiss German name of the country, Schwiiz, is homophonous to that of the canton and the settlement, but distinguished by the use of the definite article (d'Schwiiz for the Confederation, but simply Schwyz for the canton and the town).",247.txt
What is the biggest university in Switzerland,"The biggest university in Switzerland is the University of Zurich with nearly 25,000 students.",247.txt
What accounts for 34% of Switzerland's exported goods,"The largest exported goods are chemicals (34% of exported goods), machines/electronics (20.9%), and precision instruments/watches (16.9%).",247.txt
What is the nickname for the Swiss national football team,Swiss are fans of football and the national team is nicknamed the 'Nati'.,247.txt
What is disucussed at the World Economic Forum in Davos,"The annual meetings of the World Economic Forum in Davos bring together top international business and political leaders from Switzerland and foreign countries to discuss important issues facing the world, including health and the environment.",247.txt
Who can serve in the Swiss military voluntarily,Compulsory military service concerns all male Swiss citizens; women can serve voluntarily.,247.txt
What is the principal official language in Switzerland,Three of Europe's major languages are official in Switzerland.,247.txt
What research is CERN dedicated to,"Geneva and the nearby French department of Ain co-host the world's largest laboratory, CERN, dedicated to particle physics research.",247.txt
What serves as the collective Head of State,"The Federal Council constitutes the federal government, directs the federal administration and serves as collective Head of State.",247.txt
What percentage of the Christian population is Catholic,"Christianity is the predominant religion of Switzerland (about 71% of resident population and 75% of Swiss citizens), divided between the Catholic Church (38.21% of the population), the Swiss Reformed Church (26.93%), further Protestant churches (2.89%) and other Christian denominations (2.79%).",247.txt
In what year did Ruth Dreifuss become president,"After obtaining suffrage at the federal level, women quickly rose in political significance, with the first woman on the seven member Federal Council executive being Elisabeth Kopp, who served from 1984–1989, and the first female president being Ruth Dreifuss in 1999.",247.txt
Who co-hosts CERN along with the French department of Ain,"Geneva and the nearby French department of Ain co-host the world's largest laboratory, CERN, dedicated to particle physics research.",247.txt
Who were the largest single group of foreigners in 2010,Italians were the largest single group of foreigners with 15.6% of total foreign population.,247.txt
What religion has immigration brought by 2%,Immigration has brought Islam (4.95%) and Eastern Orthodoxy (around 2%) as sizeable minority religions.,247.txt
What year did Switzerland join the United Nations,Only in 2002 did Switzerland become a full member of the United Nations and it was the first state to join it by referendum.,247.txt
When was Switzerland's policy of neutrality internationally recognized,Its policy of neutrality was internationally recognised at the Congress of Vienna in 1815.,247.txt
What was the original goal of the Swiss military strategy,"The British goal was said to be for efficient administration but the people of Bengal were outraged at the apparent ""divide and rule"" strategy.",304.txt
What is the world's largest laboratory,It had been the world's largest exporter of rice.,226.txt
What do the Italian Swiss call Switzerland,"Straddling the intersection of Germanic and Romance Europe, Switzerland comprises four main linguistic and cultural regions: German, French, Italian and Romansh.",247.txt
What is typical weather in Switzerland during the summer months,"Generally, temperatures similar to those experienced in the northern part of Europe in summer last about 8 months, from April to November.",160.txt
"Besides the U.N. Headquarters, who hosts many U.N. agencies","Apart from the United Nations headquarters, the Swiss Confederation is host to many UN agencies, like the World Health Organization (WHO), the International Labour Organization (ILO), the International Telecommunication Union (ITU), the United Nations High Commissioner for Refugees (UNHCR) and about 200 other international organisations, including the World Trade Organization and the World Intellectual Property Organization.",247.txt
What does DETEC stand for,"DCS is reported to stand for ""Digital Collection System""; the system has the same functions as before.",151.txt
What did the Alemannic Schwiizer help form the nucleus of,"The name Switzer is from the Alemannic Schwiizer, in origin an inhabitant of Schwyz and its associated territory, one of the Waldstätten cantons which formed the nucleus of the Old Swiss Confederacy.",247.txt
What is the population of the smallest canton,"However, there are considerable differences between the individual cantons, most particularly in terms of population and geographical area.",247.txt
What do the French Swiss call Switzerland,"The French spoken in Switzerland has similar terms, which are equally known as Helvetisms.",247.txt
Who mainly administers the Swiss railway system,"The network is administered mainly by the Federal Railways, except in Graubünden, where the 366 km (227 mi) narrow gauge railway is operated by the Rhaetian Railways and includes some World Heritage lines.",247.txt
What is thrown in the Swiss competition Steinstossen,"Steinstossen is the Swiss variant of stone put, a competition in throwing a heavy stone.",247.txt
Who are Swiss citizens required to buy health insurance from,"Swiss citizens are universally required to buy health insurance from private insurance companies, which in turn are required to accept every applicant.",247.txt
What was the Act of Mediation responsible for restoring,The result was the Act of Mediation which largely restored Swiss autonomy and introduced a Confederation of 19 cantons.,247.txt
What was the name of Waugh's work,Coulton Waugh attempted the first comprehensive history of American comics with The Comics (1947).,58.txt
Who used cognitive science to learn how people understand comics,Agriprocessors claimed that it was at a loss to understand the allegations.,273.txt
When did Mutt and Jeff appear,"Shorter, black-and-white daily strips began to appear early in the 20th century, and became established in newspapers after the success in 1907 of Bud Fisher's Mutt and Jeff.",58.txt
What type of ink is often used in making comics,"Cartooning is most frequently used in making comics, traditionally using ink (especially India ink) with dip pens or ink brushes; mixed media and digital technology have become common.",58.txt
Comic books are what type of books,"The term ""comic book"" has a similarly confusing history: they are most often not humorous; nor are they regular books, but rather periodicals.",58.txt
"With webcomics, readers have access to what","They are able to reach large audiences, and new readers usually can access archived installments.",58.txt
What does an inker do,"Particularly in American superhero comic books, the art may be divided between a penciller, who lays out the artwork in pencil; an inker, who finishes the artwork in ink; a colourist; and a letterer, who adds the captions and speech balloons.",58.txt
When did Outcault's The Yellow Kid appear in newspapers,"Europeans have seen their tradition as beginning with the Swiss Rodolphe Töpffer from as early as 1827 and Americans have seen the origin of theirs in Richard F. Outcault's 1890s newspaper strip The Yellow Kid, though many Americans have come to recognize Töpffer's precedence.",58.txt
When did comic supplements start showing up in Japan,"New publications in both the Western and Japanese styles became popular, and at the end of the 1890s, American-style newspaper comics supplements began to appear in Japan, as well as some American comic strips.",58.txt
What is the name given to Japanese comics volumes,The drug was given the commercial name Salvarsan.,179.txt
What is ukiyo-e an example of,"The ukiyo-e artist Hokusai popularized the Japanese term for comics and cartooning, manga, in the early 19th century.",58.txt
What method is mostly used in making comics,"Gell-Mann says no, Dick's methods are not the same as the methods used here.",360.txt
What association with comics is strong,The legates agreed to change if they could find a strong leader.,287.txt
What format did adult comics begin to be published in,"Adult-oriented and experimental comics flourished in the 1970s, such as in the experimental science fiction of Mœbius and others in Métal hurlant, even mainstream publishers took to publishing prestige-format adult comics.",58.txt
What Chinese word was derived from the Japanese word manga,"The World of Japanese Comics in 1983 led to the spread of use of the word manga outside Japan to mean ""Japanese comics"" or ""Japanese-style comics"".",58.txt
What publication is Schodt responsible for,The publication of Frederik L. Schodt's Manga!,58.txt
When did Hosokibara create Nihon Manga-Shi,The first historical overview of Japanese comics was Seiki Hosokibara's Nihon Manga-Shi[i] in 1924.,58.txt
When is the term comics considered singular rather than plural,"The English term comics is used as a singular noun when it refers to the medium and a plural when referring to particular instances, such as individual strips or comic books.",58.txt
Pilote cartoonists were upset with censorship and what,Frustration with censorship and editorial interference led to a group of Pilote cartoonists to found the adults-only L'Écho des savanes in 1972.,58.txt
What are there prominent examples of in comic history,"Theorists such as Töpffer, R. C. Harvey, Will Eisner, David Carrier, Alain Rey, and Lawrence Grove emphasize the combination of text and images, though there are prominent examples of pantomime comics throughout its history.",58.txt
"Who helped ""graphic novel"" get public attention",The graphic novel—book-length comics—began to gain attention after Will Eisner popularized the term with his book A Contract with God (1978).,58.txt
Narrative is placed into panels using what,Size and arrangement of panels contribute to narrative pacing.,58.txt
Storyboards are used a lot by what,"The parking lot accommodates 1,200 cars.",428.txt
What are the individual images with action called in comics,"Panels are individual images containing a segment of action, often surrounded by a border.",58.txt
Comics for adults began to be called what,"Adult-oriented and experimental comics flourished in the 1970s, such as in the experimental science fiction of Mœbius and others in Métal hurlant, even mainstream publishers took to publishing prestige-format adult comics.",58.txt
Who put together a history of American comics in 1947,Coulton Waugh attempted the first comprehensive history of American comics with The Comics (1947).,58.txt
What book did Will Eisner create in 1985,Will Eisner's Comics and Sequential Art (1985) and Scott McCloud's Understanding Comics (1993) were early attempts in English to formalize the study of comics.,58.txt
What Russian word is used for comics,"Many cultures have taken their words for comics from English, including Russian (Russian: Комикс, komiks) and German (comic).",58.txt
Who started the first Japanese comic strip in modern times,"1900 saw the debut of the Jiji Manga in the Jiji Shinpō newspaper—the first use of the word ""manga"" in its modern sense, and where, in 1902, Rakuten Kitazawa began the first modern Japanese comic strip.",58.txt
What are Japanese comics called,Japanese comics are collected in volumes called tankōbon following magazine serialization.,58.txt
Serialization of comics became less popular when,"From the 1980s, mainstream sensibilities were reasserted and serialization became less common as the number of comics magazines decreased and many comics began to be published directly as albums.",58.txt
When did comic books make an appearance,"As of 2008, Marvel and its major, longtime competitor DC Comics shared over 80% of the American comic-book market.",220.txt
What is Japanese cartooning known as,"Comics studies courses have proliferated at Japanese universities, and Japan Society for Studies in Cartoon and Comics (ja)[l] was established in 2001 to promote comics scholarship.",58.txt
What comics began to dominate in Europe,"The success of Zig et Puce in 1925 popularized the use of speech balloons in European comics, after which Franco-Belgian comics began to dominate.",58.txt
Who does not often see storyboards used in film making,"Film studios, especially in animation, often use sequences of images as guides for film sequences.",58.txt
Who introduced satirical strips to Japan,Illustrated magazines for Western expatriates introduced Western-style satirical cartoons to Japan in the late 19th century.,58.txt
When did Rodolphe TÃ¶pffer create cartoons,"The history of European comics is often traced to Rodolphe Töpffer's cartoon strips of the 1830s, and became popular following the success in the 1930s of strips and books such as The Adventures of Tintin.",58.txt
Storyboards are not considered what,Some consider storyboards and wordless novels to be comics.,58.txt
What comic strip was created by Osamu Tezuka,"The modern era of comics in Japan began after World War II, propelled by the success of the serialized comics of the prolific Osamu Tezuka and the comic strip Sazae-san.",58.txt
"Who introduced the term ""multiframe""","In 1987, Henri Vanlier introduced the term multicadre, or ""multiframe"", to refer to the comics a page as a semantic unit.",58.txt
When did Jiji Manga debut,"1900 saw the debut of the Jiji Manga in the Jiji Shinpō newspaper—the first use of the word ""manga"" in its modern sense, and where, in 1902, Rakuten Kitazawa began the first modern Japanese comic strip.",58.txt
How were comics published when serialization became less common,"From the 1980s, mainstream sensibilities were reasserted and serialization became less common as the number of comics magazines decreased and many comics began to be published directly as albums.",58.txt
When did super heroes become popular again in comic books,"In late 1994, Marvel acquired the comic book distributor Heroes World Distribution to use as its own exclusive distributor.",220.txt
What comics are on the Internet,Webcomics are comics that are available on the internet.,58.txt
What 1925 cartoon made speech bubbles popular,"The most popular was Punch, which popularized the term cartoon for its humorous caricatures.",58.txt
What was created in 2001 to give students comic scholarships,"Comics studies courses have proliferated at Japanese universities, and Japan Society for Studies in Cartoon and Comics (ja)[l] was established in 2001 to promote comics scholarship.",58.txt
Comics were quoted as a sabotage of art and what,"As in the US, at the time comics were seen as infantile and a threat to culture and literacy; commentators stated that ""none bear up to the slightest serious analysis"",[c] and that comics were ""the sabotage of all art and all literature"".",58.txt
What century had comics in wide production,Clothing can and has in history been made from a very wide variety of materials.,196.txt
What word is used in Japan for comics,"The World of Japanese Comics in 1983 led to the spread of use of the word manga outside Japan to mean ""Japanese comics"" or ""Japanese-style comics"".",58.txt
What is the definitive factor of bandes dessinÃ©es,"The French term for comics, bandes dessinées (""drawn strip"") emphasizes the juxtaposition of drawn images as a defining factor, which can imply the exclusion of even photographic comics.",58.txt
When did Ally Sloper first appear,On occasion the cartoons in these magazines appeared in sequences; the character Ally Sloper featured in the earliest serialized comic strip when the character began to feature in its own weekly magazine in 1884.,58.txt
What word is used in France for comics,"The World of Japanese Comics in 1983 led to the spread of use of the word manga outside Japan to mean ""Japanese comics"" or ""Japanese-style comics"".",58.txt
French comics are also known as what,"The French spoken in Switzerland has similar terms, which are equally known as Helvetisms.",247.txt
What does bandes dessinÃ©es mean,"Some plants reproduce sexually, some asexually, and some via both means.",222.txt
What comic strip did Bud Fisher have success with,"Shorter, black-and-white daily strips began to appear early in the 20th century, and became established in newspapers after the success in 1907 of Bud Fisher's Mutt and Jeff.",58.txt
When did gag single-panel illustrations become known as cartoons,"Gag cartoons first began to proliferate in broadsheets published in Europe in the 18th and 19th centuries, and the term ""cartoon""[h] was first used to describe them in 1843 in the British humour magazine Punch.",58.txt
When did comic strips start appearing in hardback collection volumes,"By the 1930s, comic strips were serialized in large-circulation monthly girls' and boys' magazine and collected into hardback volumes.",58.txt
MÃ©tal hurlant was of what genre,"Adult-oriented and experimental comics flourished in the 1970s, such as in the experimental science fiction of Mœbius and others in Métal hurlant, even mainstream publishers took to publishing prestige-format adult comics.",58.txt
"When was ""The Adventures of Tintin"" serialized","The Adventures of Tintin, with its signature clear line style, was first serialized in newspaper comics supplements beginning in 1929, and became an icon of Franco-Belgian comics.",58.txt
Webcomics reach large audiences and new what,"They are able to reach large audiences, and new readers usually can access archived installments.",58.txt
What is the term used to describe the Pala Empire,Nalanda reached its height under the patronage of the Pala Empire.,304.txt
In what area did the Chola Empire establish political unity,Rajaraja Chola I and his equally distinguished son Rajendra Chola I gave political unity to the whole of Southern India and established the Chola Empire as a respected sea power.,304.txt
By when had the Maratha kingdom become an empire,"Datta wrote about Bajirao I: By the early 18th century, the Maratha Kingdom had transformed itself into the Maratha Empire under the rule of the Peshwas (prime ministers).",304.txt
When did the Mature Indus Civilization thrive ,"According to Don Bosco's prophecy: ""Between parallels 15 and 20, around a lake which shall be formed; A great civilization will thrive, and that will be the Promised Land.""",428.txt
Who insisted that schooling be a priority in India,"In education, Thomas Babington Macaulay had made schooling a priority for the Raj in his famous minute of February 1835 and succeeded in implementing the use of English as the medium of instruction.",304.txt
By what dentury did Buddhism disappear form much of India,"Although Buddhism did not disappear from India for several centuries after the eighth, royal proclivities for the cults of Vishnu and Shiva weakened Buddhism's position within the sociopolitical context and helped make possible its decline.",304.txt
What leader started a mass movement against British rule,From 1920 leaders such as Mahatma Gandhi began highly popular mass movements to campaign against the British Raj using largely peaceful methods.,304.txt
What militaristic leader restored might to the Kalinga empire,"Alexander, after the meeting with his officer, Coenus, and learning about the might of Nanda Empire, was convinced that it was better to return.",304.txt
Followers what religion were the rulers of the Punjabi Kingdom,"The Punjabi kingdom, ruled by members of the Sikh religion, was a political entity that governed the region of modern-day Punjab.",304.txt
During what span of time did the Pala Empire thrive,Nalanda reached its height under the patronage of the Pala Empire.,304.txt
What style of architecture developed during the Chaluka reigns ,The reign of Shah Jahan was the golden age of Mughal architecture.,304.txt
What was the duration of the Vedic culture,"The Vedic culture is described in the texts of Vedas, still sacred to Hindus, which were orally composed in Vedic Sanskrit.",304.txt
What appointments were  the first step in Indian self-rule,The first step toward Indian self-rule was the appointment of councillors to advise the British viceroy in 1861 and the first Indian was appointed in 1909.,304.txt
What dynasty made military alliances with the Kamdamba,This military decision made solely by China changed the attitude of the Soviet Union.,199.txt
What early social movement occurred during this time of awakening,"One of the earliest social movements that emerged during this time was the Young Bengal movement, which espoused rationalism and atheism as the common denominators of civil conduct among upper caste educated Hindus.",304.txt
To what dynasty was Kashmir sold in 1849,"Punjab, North-West Frontier Province, and Kashmir were annexed after the Second Anglo-Sikh War in 1849; however, Kashmir was immediately sold under the Treaty of Amritsar to the Dogra Dynasty of Jammu and thereby became a princely state.",304.txt
In what country was the trading base for the Dutch,"The next to arrive were the Dutch, with their main base in Ceylon.",304.txt
Who ruled the Maratha Empire,"In 1737, the Maratha general Bajirao of the Maratha Empire invaded and plundered Delhi.",304.txt
What was the architectural style of the Chalukyas,"The Western Chalukyas developed an architectural style known today as a transitional style, an architectural link between the style of the early Chalukya dynasty and that of the later Hoysala empire.",304.txt
In what type of architecture did the Cholas excel ,Features of all three of the other types of diarrhea[clarification needed] can be found in this type of diarrhea.,347.txt
During what time were the Anglo-Mysore Wars,The Company soon expanded its territories around its bases in Bombay and Madras; the Anglo-Mysore Wars (1766–1799) and later the Anglo-Maratha Wars (1772–1818) led to control of the vast regions of India.,304.txt
What means did Gandhi espouse to gain self-rule,"The self/nonself theory of immunity and the self/nonself vocabulary have been criticized, but remain very influential.",111.txt
Who was the leader of the Punjabis ,"It was forged, on the foundations of the Khalsa, under the leadership of Maharaja Ranjit Singh (1780–1839) from an array of autonomous Punjabi Misls.",304.txt
On what was the disciplined force Singh relied ,Ranjit Singh proved himself to be a master strategist and selected well qualified generals for his army.,304.txt
When was the Arab invasion repulsed,"The south Indian Chalukya empire under Vikramaditya II, Nagabhata I of the Pratihara dynasty and Bappa Rawal of the Guhilot dynasty repulsed the Arab invaders in the early 8th century.",304.txt
What was the kingdom of the Shahis called,"The Hindu Shahis under Jayapala, is known for his struggles in defending his kingdom against the Ghaznavids in the modern-day eastern Afghanistan and Pakistan region.",304.txt
Who attacked and plundered Delhi in 1737,"In 1737, the Marathas defeated a Mughal army in their capital, Delhi itself in Battle of Delhi (1737).",304.txt
What group wanted to conquer India from earliest times,"The subsequent Slave dynasty of Delhi managed to conquer large areas of northern India, while the Khilji dynasty conquered most of central India but were ultimately unsuccessful in conquering and uniting the subcontinent.",304.txt
What was the time span of the Shunga Empire,The Shunga Empire played an imperative role in patronizing Indian culture at a time when some of the most important developments in Hindu thought were taking place.,304.txt
What part of India was never completely conquered,"The Chola dynasty conquered southern India and successfully invaded parts of Southeast Asia, Sri Lanka, Maldives and Bengal in the 11th century.",304.txt
